Domain,Keyphrases,Cluster
6ott-mit-uns, uns  LiveJournal User agreement   mit,2
russialist, Block Technical Data  Technical Data  Wordfence blocking  Wordfence at Wed  Apr  site  learn about Wordfence  Generated by Wordfence  Wordfence to manage   Wordfence,8
grindr, Grindr LLC  LGBTQ community  Grindr for Equality  Privacy Policy  LGBTQ  Personal Information  Community Guidelines  Grindr feature  Grindr users   Grindr,7
maidanua, War Crimes  Russian War Crimes  War   War Crimes Documentation,8
mister-tt, Italiano Русский Українська  RSS Reader  User agreement  accept LiveJournal User  LiveJournal  account  User agreement mister  Log   LiveJournal User agreement,2
casinoking, full experience  browser  Casino Club  experience  full  browsers  version  Google Chrome  Club   Download,8
absinth, Vintage Absinthe Reproduction  Logan Fils absinthe  Vintage Absinthe  Absinthe Ritual  Absinthe Production  Fils modern absinthe  Pernod Fils  Absinthe Accessories  Logan Fils   Absinthe,8
ilga-europe, European LGBTI movement  LGBTI  LGBTI movement  LGBTI organisations  Central Asia  Europe and Central  LGBTI organisations work  Europe  European LGBTI   LGBTI people,8
ihf-hr, Central Helsinki Hotell  OSCE Human Dimension  Helsinki Federationfor Human  Hotell Helsingfors  Hotel Art Helsingfors  Central Asian OSCE  Grand Central Helsinki  Plaza Helsinki Hotell  Marina Hotell Helsingfors   International Helsinki Federation,8
anonymitychecker, CONTRACTOR  Domain Brokerage Services  Brokered Domain  API Transactional Services  Rental Agreement  SERVICE PROVIDERS  transfer service provider  domain  services   PARTY SERVICE PROVIDERS,4
gamespot, Wars Jedi  Star Wars Games  Wars Jedi Survivor  Star Wars  Jedi Survivor Guides  Free Prime Games  Jedi Survivor  Star Rail Redemption  Wars   Star Wars Jedi,8
delicious, Delicious  Privacy Policy  Delicious Content  User Content  data  Terms  personal  information  Privacy   Personal Data,7
hrea, International Youth Day  International Day  World Day  HREA Events  Day  Earth Day  Youth Day  Human Rights Education  Current Projects   International Earth Day,8
bit, Bitly  URL  URL Shortener  Bitly Link Management  short URL  Code  custom URL shortener  Free Link  Codes   Free Link Shortener,8
merchant, Merchant WebMoney Transfer  directory not found  WebMoney Transfer  Merchant WebMoney  File  Merchant  Transfer  WebMoney  Server Error   File or directory,8
forums, famous classical music  popular classical music  classical music composers  Classical Music Album  Kickass Classical  Kickass Classical Forums  top Classical Music  Kickass Classical Top  Classical features Classical   Classical Music,8
leteha, Danilin Pavel  commentShareFlag Дневники информационной  Pavel Вот для   Danilin Pavel Вот,8
beerinfo, Open Beer Championship  World Beer  Beer Cup  Open College Beer  Open Cider  Brewing Company  Craft Beer Releases  Brewing Company Brewing  Open College   World Beer Cup,8
emule, EUR  domain  Domain Marketplace  Sedo Domain  domain emule.com  GBP  USD  Sedo  offer   Sedo Domain Marketplace,4
donnerwort, Italiano Русский Українська  User agreement donnerwort  LiveJournal User agreement  Privacy Policy   Pussy Riot,2
gayegypt, Gay PrideLos Angeles  Gay PrideMaspalomas Winter  Gay PrideSydney Margi  Gay PrideWashington Capital  Circuit FestivalBerlin Gay  Angeles PrideMadrid Gay  Beach PrideMunich Gay  LGBTQ Friendly  Gay   LGBTQ Friendly Egypt,8
weedfarmer, Cannabis Growing Guide  Buy Cannabis Seeds  Cannabis  Cannabis Seeds  buy Weed Seeds  Cannabis Growing  Cannabis seeds growing  Cannabis Grow  Cannabis Sites   Cannabis Grow Guide,8
3a-pycb,  LiveJournal User agreement,2
reinform, Italiano Русский Українська  User agreement  LiveJournal  community  accept LiveJournal User   LiveJournal User agreement,2
alexabarboss, Alex Sss  Alex Sss Киев  FacebookПоделиться в Pinterest   Pinterest Ярлыки,8
shia, Contact E-Mail  Islamic Organizations  Contact  Imam Ali  Islamic  Number  Important Muslims  Islamic Education Center  Phone   Phone Number,8
aidsalliance, Frontline AIDS  World AIDS Day  Frontline AIDS stands  Frontline AIDS staff  Frontline AIDS offers  FRONTLINE AIDS UKRAINE  AIDS  AIDS Day  AIDS partnership   Frontline AIDS partnership,8
ukrainianweek, Ukrainian Week  Week LLC  Ukrainian Week Share  Ukrainian  Ukraine  Russia  Week  Russian   Ukrainian Week LLC,8
gurby,  Internal Server Error,8
weblogs, Hardware Tagged ssd  Status Updates  Resources Tagged cpanel  Weblogs.us servers continue  Resources Tagged  Continue reading  Status  Weblogs.us blog  Hardware Tagged   Status Updates Tagged,8
blackblocg, Tutorial Google Adsense  konten google adsense  Berita Terkini Internasional  adsense indonesia internasional  menulis konten google  Portal Berita Online  Tips Menulis Konten  Google Adsense  Berita Online Terbaik   Google Adsense Indonesia,0
neonjoint, Business Phone System  Cloud Contact Center  Cookie Consent plugin  GDPR Cookie  Cookie Consent  Customer Success Program  contact center solutions  Broadvoice Success Program  Contact Center   GDPR Cookie Consent,8
depositfiles, Unknown Error Invalid  incorrect Unknown Error  read Cookie Policy  Unknown Error Complete  Location Current password  password  enter  Policy  Cookie Policy   Web Shield Limited,8
cannaweed, pour  par  sur les  sur  des  cannabis  pas  pars sur une  Topic Unique   les,8
delicates, Lingerie  Sexy Lingerie Sets  Open Lingerie Set  Lingerie Collection  Add to Wishlist  Sexy Lingerie  Lingerie Blog  Lingerie Sets  Thong Lingerie   Pearl Thong Lingerie,8
avert, HIV information page  hiv hiv sex  HIV information  HIV testing resources  HIV testing  HIV personal stories  Healthworkers’ HIV Hub  HIV timeline  living hiv hiv   HIV,7
cwgl, CWGL Leadership Member  Women Global  CWGL Team Member  Global Leadership  CWGL Affiliates Member  CWGL Advisory Board  CWGL Team  Women  Rutgers SAS Navigation   Women Global Leadership,8
hoteljans, Restaurant Jans  Hotel Jans  Hotel Restaurant  bij Hotel Restaurant  Restaurant Jans een  Jans  Restaurant Jans beschikt  Hotel  Restaurant   Hotel Restaurant Jans,8
iavi, International AIDS Vaccine  HIV vaccine research  HIV vaccine  AIDS Vaccine  IAVI HIV prevention  Infectious Diseases Vaccines  IAVI  AIDS vaccine research  HIV vaccine candidates   AIDS Vaccine Initiative,8
abcunderwear, Men Underwear Clearance  Men Underwear Men  Clearance Men Thongs  Clearance Men Swimwear  Men Bikini Underwear  NDS Wear Underwear  Men Bikini Swimsuits  Men Thong Swimsuits  Clearance Men Costumes   Clearance Men Underwear,8
godalone, Worship  God   Worship God,8
community, Skill Gaming  Gaming Region  Destination Category  GAMES skill gaming  Life  PickPick a Destination  Life Destination Guide  Linden Research  Editors' PickPick   Skill Gaming Region,8
ectaco, Translation Software  Software Collections  Talking Electronic Dictionaries  PDA Electronic Dictionaries  Language Learning  Foreign Language Learning  Windows translation software  Software  Text Translation Software   Electronic Dictionaries,8
diplomaticsecondpassport, Passport Offers  diplomatic passport  Ireland Passport  Paraguay Passport  Brazil Passport  Bulgaria Passport  Cyprus Passport  Montenegro Passport  Nicaragua Passport   passport,8
iyfnet, Enable JavaScript  cookies to continue  Enable  continue  JavaScript  cookies  JavaScript and cookies   moment,6
businessweek, Cookie Policy  robot  reference  Contact  Service and Cookie  JavaScript and cookies  review our Terms  Policy  cookies   Bloomberg,8
globalfire, DIE TREUEN FREUNDE  LiteSpeed Technologies Inc.  und  Hintergründe und Täter  Wissen ist Macht  Technologies Inc.  Medienerzeugnisse der Antideutschen  Feuer der Wahrheit  die   Found,8
idea, Democracy  Publications Publications Overview  International IDEA Policy  IDEA Policy Paper  Work Overview  Global Democracy Coalition  Policy Papers  Global State  IDEA   International IDEA,0
delo, Online Web Services  United Online Web  Web Services  United Online  Web site today  Web Hosting Services  Web Hosting  UOL Web  Web site   UOL Web Services,5
darknet, Download Hacking Tools  Web Hacking Software  latest hacking tools  Networking Hacking Tools  Range Discovery Tool  Key Cracker Tool  Hacking  hacking-windows hacking tool  Crackable WPA Key   Hacking Tools,8
thepiratebay, Bay  resilient BitTorrent site  BitTorrent site  Pirate  galaxy most resilient  resilient BitTorrent  Download music  Torrents  site   Pirate Bay,8
guardian, Guardian Puzzles app  Guardian Puzzles  Brett Kavanaugh assault  Video  Guardian Licensing  Guardian Australia  Brett Kavanaugh  Australia edition switch  Guardian Australia newsletters   Guardian,8
tanzil, Tanzil  Quran  Navigator   Quran Navigator,8
btselem, page  reload the page  DDoS  society  turn  JavaScript  reload  protection  civil   moment,8
deathmetal, Death Metal Underground  Death Metal  black metal  Metal  Metal Underground  Metal Underground.Death Metal  Editionby Brett Stevens  black metal metal   Brett Stevens,8
pornolab,  PornoLab.Net,1
gayscape, Live Guys Cams  Free Users Chat  Star Video Archive  Private Video Preview  FREE Unlimited Access  Adult Star Video  Webcam Show  hour Feature Shows  Guys Cams   Private Webcam Show,5
hon, Foundation  Net  Health   Net Foundation,1
foxnews, Privacy Choices Closed  Closed Captioning Policy  Fox  Choices Closed Captioning  Facebook Twitter Instagram  Privacy Policy  Twitter Instagram RSS  Fox Nation  Instagram RSS Email   FactSet Digital Solutions,0
aleph, Public Relations Department  Aleph  Aleph （アレフ）  Public Relations  Aleph 広報部の許可なく配布・掲載することを禁止します   Aleph （アレフ） 公式サイト,8
chertog, linkpost comment Мои  comment Мои  User agreement Склад  LiveJournal User agreement  LiveJournal  accept LiveJournal User   comment Мои твиты,2
earthwatch, Support Scientific Research  Earthwatch  Research Focus Areas  research expeditions  Student Group Expeditions  Earthwatch Expedition  Earthwatch Research Expedition  Group Expeditions  Earthwatch Institute   field research expeditions,8
eluniversal, VER MÁS  Universal  NOTA DE PRENSA  MÁS  Diario  VER  EDICIÓN DEL DÍA  del  los   Diario El Universal,8
hizb-ut-tahrir, Tahrir  die  Hizb  Bin Khalil Abu   Hizb ut Tahrir,8
inter,  Inter,8
domainnamesales, Copyright  Buy this domain  Privacy Policy  Reserved  Policy  Buy  domain  Privacy   vsezoo.com,0
hotgaylist, votes 06:24 min  votes  min  votes 03:27 min  gay porn videos  votes 05:16  votes 05:32 min  votes 05:04 min   votes 05,8
ifge, Gender Identity Disorders  International Foundation  IFGE Annual Conference  Rush Transgender Conference  Gender Identity  Foundation for Gender  Gender Education Commemorates  Annual Transgender Day  IFGE Capital Conference   Gender Education,1
caseofpussyriot, Pussy Riot провели  Pussy Riot три   Pussy Riot,8
feminist, Feminist Majority  Majority Foundation  Girls Learn International  Feminist  Afghan Women  Women  Feminist Campus  Feminist Jobs  Majority   Feminist Majority Foundation,1
anaitiss, Italiano Русский Українська  User agreement  LiveJournal  accept LiveJournal User  account   LiveJournal User agreement,2
alt, contact Customer Service  Magnolia Blossom  Terms  Dating Services  BDSM  content  Customer Service  Internet Dating Safety   SERVICES,4
anonym, anonym.to link everything.  links  anonym.to  anonym.to link  Script  link  global templates  link everything. anonymously  link everything.   anonym.to anonym.to link,8
laborrights, Forced Labor  International Labor  Labor  LaborEnding Forced Labor  Tobacco FarmersFair Labor  Global Labor Justice-International  Labor Rights Forum  Global Labor  Global Labor Justice   Labor Justice-International Labor,8
ccrjustice, Immigration PracticesCorporate Human  War Crimes  CCR Annual Report  Center  Constitutional  Abusive Immigration Practices  Records ProjectSouthern Justice  Bertha Justice Fellows  CCR   Center for Constitutional,8
lurkmore, coffee   english buy,8
anonymsurfen, Vollständige Meldung bei  Meldung bei  Anonym Surfen  Vollständige Meldung  das anonyme Surfen  bei ZDFheute  komplett anonym Surfen  Meldung  Trainer Thomas Doll   Meldung bei ZDFheute,8
wsj, Wall Street  Dow Jones  Dow Jones Reprints  Street Journal  Real EstateMoreReal Estate  Jones ProductsBarron'sBigChartsDow Jones  Jones BusinessesDow Jones  StoriesAdsAdvertiseCommercial Real Estate  Real Estate AdsPlace   Wall Street Journal,8
barmeister, credentials  bad password  document requested  requested  authorized to access  access the document  bad  password  required   Unauthorized,8
exscn, Message Board  Scientologist Message  Scientology  Messages  Search  Search titles  Board  Search forums  Replies   Scientologist Message Board,8
bat, British American Tobacco  BAT Canada recognised  Skip General Navigation  BAT  Imperial Tobacco Canada  Navigation Set  ESG Report  American Tobacco  BAT Canada   General Navigation Set,8
tyzhden, auditoriumТарас ЛютийОлексій СокиркоВіталій   Skovoroda auditoriumТарас ЛютийОлексій,8
facebook, browser window.Join Facebook  Facebook  Facebook Graph API  Meta Pay  supported by Facebook  Meta  window.Join Facebook  simpler version  version to give   Facebook Lite Facebook,8
another-kashin, LiveJournal User agreement  Italiano Русский Українська  User agreement  accept LiveJournal User  User   User agreement Кашин,2
bfed, Server Default Page  Server Default  Web Server  Default Page  Server  Default  Web  Page  Web site   Web Server Default,5
89, Free Porn  Free  Porn  Free porn SEX  Free Dating  Porn Search  FREE PORN VIDEOS  Free Adult Directory  Straight Porn Search   Dating,5
dan, party service providers  domain ownership transfer  domain  services  Brokered Domain  service providers  Client  Dan.com  domain ownership   CONTRACTOR,4
getdrupe, Party Services  app  information  services  Users' Personal Information  collect Personal Information  communication apps  Personal  sell personal information   Personal Information,7
ilga, ILGA World resources  ILGA World maps  Bodies Annual Reports  Legal Mapping Report  ILGA World Conference  ILGA World Board  ILGA World Annual  Sex Characteristics Programme  Making Rainbow Waves   ILGA World,8
goarch, Greek Orthodox Church  Greek Orthodox  Orthodox Archdiocese  Orthodox Christian faith  Greek Orthodox Parish  Greek Orthodox Christian  Nicholas Greek Orthodox  Holy Eparchial Synod  Eminence Archbishop Elpidophoros   Greek Orthodox Archdiocese,8
surfshield, Peluang Bisnis Online  Bisnis Online Sukses  Bisnis Online  Membuat Bisnis Online  Bisnis Online Wajib  Kelemahan Bisnis Online  Bisnis Online Terbaik  Sukses Bisnis Online  Rekomendasi Peluang Bisnis   Bisnis Online Yang,0
ww1, information  Personal  Privacy Policy  SERVICES  including Personal Information  collect Personal Information  Personal Information protection  Privacy  personal information stored   Personal Information,7
pictureview, Interactive Classifieds Network  Network Corporation  Classifieds Network  Interactive Classifieds  Free Demo  PictureView  Demo  Sign   Classifieds Network Corporation,8
drugs-forum, Journal Entries  Journal Comments  Recent Posts  Reviews  Drug Test Kits  Links  Spot Test Kit  Journals List  Media   Quick Links,8
ipress,  Economist Переклад iPress,8
advisor, JavaScript enabled  work properly  properly without JavaScript  WebMoney  enabled  AdvisorWe  advisor-front  work  properly   WebMoney AdvisorWe,8
familycareintl, Information  Privacy Policy  Personal  SERVICES  Privacy  including Personal Information  collect Personal Information  Personal Information protection  Policy   Personal Information,7
globalequality, Non-Profit Soapbox  Global Equality  Report Cards  Global  Page  Council  Informed  Page Not Found  Finances   Found,8
company, Wizards Play Network  Fan Content  Game Services  Wizards  Information Collected Automatically  Privacy Policy  contact data  service  Personal Information   Fan Content Policy,7
psyplants,  DWC and SOILLED,8
ijm, IJM  Gift Catalog  IJM Gift Catalog  Gift  Freedom Partner  Monthly Gift  Monthly Gift Amount  Enter Monthly Gift  Justice Mission   International Justice Mission,8
catholicsforchoice, Press Center  Catholics  Conscience Magazine  Catholic Healthcare  Catholic  Conscience  Reproductive Equity  Catholic Social Justice  reproductive freedom   Catholics for Choice,8
insecure, Nmap  Nmap version detection  Nmap Scripting Engine  Daniel Miller  Nmap XML output  Nmap Network Scanning  Nmap Security  Nmap Public Source  Patrik Karlsson   Nmap Security Scanner,8
christianity, Bible  God  Bible Study Tools  Bible Trivia Challenge  God Hear  Bible Baseball  Bible Jeopardy  Large Print Bible  Jesus   Bible Trivia,8
teenadvice, Great Outdoors  Career Paths  Humor  Business Ownership  Web Humor  Performing Arts  Political Humor  Visual Arts  Arts   Cookies Settings Accept,8
ceceurope, CEC General Assembly  European Churches  Churches  Cookies  CEC General  Apr  General Assembly  Middle East  European   CEC,8
minorityrights, Cookie Consent plugin  GDPR Cookie  Cookie Consent  cookie  Group International newsletter  cookie is set  cookies  user consent  cookies store information   GDPR Cookie Consent,8
progressio, development worker  worker experiences blogWhat  blogDevelopment worker experiences  worker experiences  Progressio ICS  Progressio ICS volunteers  blogICS blogDevelopment worker  blogsJobsDevelopment worker FAQsWhat  questionsVolunteer blogsJobsDevelopment worker   Development worker experiences,8
vienna, Colorful List Accent  Colorful Grid Accent  Light List Accent  List Table  Light Grid Accent  Grid Table  Locked  Dark List Accent  img src   LsdException Locked,8
bbc, morenextArticle share toolsFacebookTwitterShareView  Search BBC Search  share toolsFacebookTwitterShareView  share optionsShare  BBC  Search BBC  morenextArticle share  menu Search BBC  optionsShare this postCopy   BBC Search BBC,8
ifj, IFJ Middle East  IFJ China Portal  IFJ  IFJ Asia Pacific  IFJ China  Latin America  IFJ World Congress  Federation of Journalists  International Federation   IFJ Latin America,8
gotgayporn, Gay Group Sex  Gay Sex Toys  Gay Sex  Gay Voyeur Sex  views  Live Sex  Sex  Gay Massage Porn  Gay Porn   Young Gay Sex,8
leontiev, LiveJournal User agreement  User agreement Добавить  User  User agreement   User agreement Мои,2
hacktivismo, para  una  las  por  Zoom  como  los píxeles  seguridad  para los   los,8
dd-rd, xapMM  Resource  rdf  stRef  stMfs  Type  endstream endobj  Inches  Resources   reference rdf,8
imdb, STARmeter Award  Upcoming Action Movies  IMDb  IMDb STARmeter  Popular MoviesBrowse Movies  Favorite STARmeter Award  Popular CelebsMost Popular  Movies  Award   IMDb STARmeter Award,8
ingushetiyaru, online slot paten  Smart Glasses Part  Slot Paten Bull  World Poker Tour  Slot Paten Book  game slot paten  Top World Sunglasses  Sunglasses Brands Part  World Sunglasses Brands   Slot Paten,0
appzplanet, Torrent download X-Art  TORRENT RAPIDSHARE DOWNLOAD  Torrent download Met-Art  Torrent download Advanced  APPZ TORRENT RAPIDSHARE  FULL APPZ TORRENT  DOWNLOAD  download X-Art Video  RAPIDSHARE DOWNLOAD ISO   Torrent download,8
democracycaucus, Democracy Coalition Project  Community of Democracies  Nations Democracy Caucus  United Nations Democracy  Democracy  Democracy Coalition  human  Democracies Convening Group  Human Rights Council   Democracy Caucus,8
lib,  obivatel про Дашко,8
de,  Loading,8
komtv, Enable JavaScript  cookies to continue  Enable  continue  JavaScript  cookies  JavaScript and cookies   moment,6
ilo, ILO  International Labour  Labour  work  International Labour Conference  international labour standards  Safety and health  decent work  social   International Labour Organization,1
care, CARE  CARE works  CARE Package  Text CARE  Français Português Español  Original CARE  Global Advisory Council  CARE response  Resources Archive   Original CARE Package,8
dfid, International Development  Web Archive  Government Web  Found  web  Department for International  correct web address  correct web  Development   Government Web Archive,5
8thstreetlatinas, Street LatinasSophia Leone  Street  Street LatinasMonica Asis  Street LatinasGina Valentina  Street LatinasAlina Lopez  Street LatinasLuna Star  Street LatinasValentina Jewels  Street LatinasNicole Rey  Street LatinasVictoria June   Street Latinas,8
idsoftware, Software  ENGLISH  language  country  FRANÇAIS  DEUTSCH  Date of Birth  ITALIANO  ESPAÑOL   Software id Software,8
banking, WebMoney авторизация АвторизоватьсяWebMoney.Login  Webmoney Для   Webmoney Для работы,8
wkkf, Mission Driven Investments  Foundation Annual Report  Diverse Managers Program  Kellogg Foundation  Resource Directory  Driven Investments  Managers Program  WKKF Web Applications  Kellogg Foundation Trust   Kellogg Foundation Annual,1
betway, Enable JavaScript  cookies to continue  Enable  continue  JavaScript  cookies  JavaScript and cookies   moment,6
actionaid, ActionAid International RSIN  Vereniging ActionAid International  International RSIN number  ActionAid  Combatting Modern Slavery  International  International RSIN  ActionAid International shows  Modern Slavery   ActionAid International,8
europacasino, Casino  Entertainment Services Malta  Services Malta Limited  Online Casino  Universe Entertainment Services  online casino games  casino games  Trusted Online Casino  Europa   Europa Casino,0
in, article with imageApril  article  Thomson Reuters  article with videoApril  opens  Biden South Korea  Fox Corp media  Tucker Carlson  Tucker Carlson part   article with galleryApril,8
bicommunitynews, issue posts newsfeed  BCN  LGBT groups call  issue posts  LGBT groups  BCN issue  Local Groups  BCN team  group   BCN issue posts,8
daymohk, slot online anda  Slot Online  Slot Online Banyak  Slot Online Bonus  Slot Online Gacor  Judi Slot Online  slot online yang  Slot Online Indonesia  Slot Online Terbesar   Situs Slot Online,0
queerussia, form  completely  filled  queerussia.info  Address  offer  optional  Buy this domain  USD   filled out completely,4
MainLinesEast, Buffalo Central Terminal  Railway Historical Society  Railroad Historical Society  Official Home Page  Model Railroad Club  Home Page  Society Home Page  Buffalo Railroad Photos  Railroad Links Page   Railroad Home Page,8
fteproxy, fteproxy  Kevin  Dyer  tor  Tor Browser Bundle  PGP SIGNATURE  Tor Browser  OSX  END PGP SIGNATURE   Kevin P. Dyer,8
opportunity, Opportunity International  Opportunity International partners  Opportunity International works  Opportunity International Financial  Opportunity Book  Opportunity International Governor  Financial Services  Digital Financial Services  Financial Reports   Opportunity Book Club,8
eccouncil, Certified Cloud Security  Application Security Engineer  Certified Application Security  Certified Threat Intelligence  Threat Intelligence Analyst  Certified Security Specialist  Democratic People Republic  Certified Cybersecurity Technician  Cloud Security   Cloud Security Engineer,8
ebaumsworld, Featured  Views  Suspicious Things People  Funny  Things  Italian Girls Mocked  Interesting Things  Comments  people   Featured Yesterday,8
emchurch, Methodist Church  Evangelical Methodist  Evangelical Methodist Church.Give  Learning Center Campaign  Church  local Evangelical Methodist  South Gray Road  Heritage Learning Center  Jesus Christ   Evangelical Methodist Church,8
agentprovocateur, Agent Provocateur  Agent Provocateur experience  Plunge Underwired Bra  size Account Details  full Agent  United States  Underwired Bra  Agent  season   full Agent Provocateur,8
heritage, Health Care Reform  Establishment Clause  Establishment Clause concerns  min read  Health Care  Heritage Foundation Research  Free Exercise Clause  Kevin Roberts Show  United States   Heritage Foundation,1
ita, Ludendorff und Frau  Die Juden der  die  daß die Juden  die Juden die  für die Juden  der  die Juden das  der Juden   die Juden,8
greennet, Legal information Complaints  Internet services  Internet  web  Bethnal Green  Oxford House  Derbyshire Street  work  practice Legal information   GreenNet,7
endryx, Italiano Русский Українська  User agreement  LiveJournal  FAQ search page  FAQ   LiveJournal User agreement,2
ru, Tucker Carlson Fox  Images Photo  Tucker Carlson  Tucker Carlson CNN  Carlson Fox rise  Getty Images  American Idol Top  Carlson Fox  Vampire straw   Getty Images Photo,8
world, TIME USA  Time  South China Sea  Anchor Claims China  California Privacy  TIME Health  TIME Guide  TIME Labs  TIME Apps   TIME Vault,8
drugoi, figure aentry-post  figure class  figure  div class  aentry-post  fullscreen aentry-post  SCANPIX   Getty Images,8
south-gir, Entries Friends Archive  Friends Archive Profile  LiveJournal User agreement  RSS Мертвый дом  RSS Reader  commentsLeave a commentShareFlag  Tags   friends RSS Мертвый,3
navalny, Found  Islands  nginx  Domain  Republic  Island  Saint  zona.me  Sav   Found nginx,8
limonka, Start payment plan  Start payment  Buy  Start  payment  payment plan  WhoIs Privacy Protection  Privacy Protection  domains   domain,0
backtrack-linux, Penetration Testing  Testing Distribution  BackTrack  Linux  Penetration  Distribution  BackTrack Linux  Testing  Kernel   Penetration Testing Distribution,8
lambdalegal, Legal Docs Archive  Lambda Legal lawyers  Legal  link leads  Lambda Legal helped  Lambda Legal cases  Lambda  Legal Docs  Legacy Case Archive   Lambda Legal,8
phrack, code  RKP  Mechanical Phish  Cyber Grand Challenge  Phrack  Phrack Staff  RKP Exception Handlers  START CODE  guest system memory   Phrack Magazine,8
