Domain,Keyphrases,Cluster
auduboninternational, Audubon Cooperative Sanctuary  Green Lodging Program  Green Hospitality Program  Audubon International  Audubon International Headquarters  Sustainable Communities Program  Signature Sanctuary Certification  Audubon International Certified  Sanctuary Program   Cooperative Sanctuary Program,8
rapidgator, Việt Монгол Հայերենի  service  Rapidgator  Infringement Policy  Policy  Privacy Policy  Tiếng Việt Монгол  personally identifiable information  Terms   Copyright Infringement Policy,0
abc, Online Privacy PolicyYour  State Privacy RightsAbout  Privacy RightsAbout Nielsen  Social ResponsibilityChildren Online  RightsAbout Nielsen Measurement  Online Privacy  Entertainment ChannelsWatch Free  State Privacy  Personal InformationInterest-Based AdsClosed   ResponsibilityChildren Online Privacy,0
arabtimes, largest Arab-American newspaper  WORLDWIDE SHIPPING  States  largest Arab-American  Arab-American newspaper  United  DOOR  SHIPPING  EMAIL   United States,8
americannaziparty, Central Helsinki Hotell  Moscow Helsinki Groups  Hotell Helsingfors  Helsinki Federationfor Human  OSCE Human Dimension  endstream endobj  Hotel Art Helsingfors  Scandic Hotell Helsingfors  Plaza Helsinki Hotell   International Helsinki Federation,8
blackjackinfo, Blackjack Basic Strategy  Blackjack Live Dealer  Strategy Basic strategy  Blackjack Strategy  Basic Strategy  Blackjack Strategy Engine  Blackjack Strategy Trainer  Blackjack GameTournamentsFree Blackjack  basic strategy cards   Online Blackjack Strategy,8
exgay, life  menu items.Your journey  peace  items.Your journey  Confidence  peace begins  told  journey to peace  live   journey,8
ua-24, Domain Registration  NameBright  Generation Domain  Coming  Registration  NameBright.com  Generation  Domain   Generation Domain Registration,4
breakingnews, Ireland World Business  Irish Times  Lifestyle Lotto Horoscopes  World Business Weather  Irish Times Group  Business Weather Archive  Soccer GAA Rugby  Times DAC  Times DAC 24-28   Irish Times DAC,8
growerz, Found  nginx   Found nginx,8
giganews, Usenet  Quality Usenet Retention  Usenet Support  Usenet service  Giganews Reviews  Internet service providers  Support  Service  Usenet Provider   Giganews,4
formercatholic, Catholic Priests  Love Priests  Catholic  Priest  Roman Catholic Church  church  Catholics  Love  Top Reasons Catholics   Catholic church,8
acquisitionx, port numbers Acquisition  DOWNLOAD ACQUISITION  Activation Code Redelivery  port  port mapping  Activation Code  ports  Port Mapping Protocol  NAT Port Mapping   Acquisition,8
copticchurch, Mark Coptic Orthodox  Pope Shenouda III  Coptic Orthodox  Orthodox Church  Coptic Church  Coptic Calendar  Coptic  Mark Coptic  Pope Shenouda   Coptic Orthodox Church,8
attrition, security  ATTRITION  jericho  information  Attrition staff  attrition.org  legal threats  Martums  time   czarina,7
4online-gambling, casinos  Online Casinos  Casino  Online gambling  Free casino game  online casino games  casino game  Online  gambling   casino game play,0
ghostrecon, Ghost Recon  Clancy Ghost Recon  Ghost Recon ChannelsEnglishStoreUBISOFT  Ubisoft Entertainment  Recon Breakpoint  guideGhost Recon Breakpoint  GHOST RECON PHOTO  Ghost Recon Operation  Ubisoft Parent guideGhost   Ghost Recon Breakpoint,8
uainforg,  Leave a commentShareFlag,8
hizb-russia, Enable JavaScript  cookies to continue  Enable  continue  JavaScript  cookies  JavaScript and cookies   moment,6
caritas, Caritas Internationalis  Human Trafficking  Caritas  North America  North Africa  work OVERVIEW  Caritas South Sudan  Reading  South Sudan   Continue Reading,8
looo, Homosexuality for Kids  Lesbianism for Kids  file publishing  Kids  Adrian Chen  Andrey Tselikov  Global Voices  Dan Avery   Loooch,8
raznesi, Zeiten des Internets  Befreiung von der  Crowdfunding bis Crowdinvesting  auf Befreiung von  Sie  Arten von Investitionen  von Crowdfunding bis  Antrag auf Befreiung  der UEC   von der UEC,8
ukraineanalysis, Ukraine  Politics in Ukraine  Luhansk People Republic  Eastern Ukraine  David Marples Ukraine  Current Politics  People Republic  David Marples  Donetsk People   Donetsk People Republic,8
triviasecurity, SSL certificate  SSL certificate presented  expired SSL certificate  SSL certificate issued  Invalid SSL  SSL  valid SSL  certificate  Certificate Authority   Invalid SSL certificate,8
hrlibrary, States Parties  United Nations human  Women Human  CEDAW Committee  United Nations Convention  reporting States parties  Minnesota Human  Women  Women Watch   CEDAW Convention,8
hanes, hanes.comPlease  blocker  enable  disable   hanes.comPlease enable,8
anon, Version von JAP  Technische Universität Dresden  für alle Nutzer  bei den Dresden  die Downloadmöglichkeiten über  Downloadmöglichkeiten über die  und Informationen über  die Dresden   JAP,8
cbc, CBC  CBC AccessibilityAccessibility Feedback  CBC shows offered  Canada  April  season  CBC shows  Canada including people  AccountProfileCBC GemNewslettersAbout CBC   CBC Gem.About CBC,8
888casino, Spins No Deposit  Online Casino  Casino  Free  Deposit  Spins  Online   Free Spins,0
goldenrivieracasino, web server timed  Connection timed  origin web server  Cloudflare  Cloudflare Ray  web  server  Error  Connection   web server,5
bittorrent, BitTorrent Web  BitTorrent Speed  services  BitTorrent Speed AppDrive  BitTorrent  English Español Русский  User Content  personal information  Terms   download BitTorrent Web,7
freedomhouse, Freedom  Kong Media Bulletin  Freedom House weekly  Annual Freedom Awards  Freedom House works  Media Freedom  Media Bulletin  Global Media Influence  Policy Recommendations   Freedom House,8
angelfire, Lycos Network Web  Lycos Network Privacy  Lycos Network Terms  Lycos Network Products  Lycos Network service  Lycos Network Search  Lycos Network sites  Lycos Network Logos  Lycos   Lycos Network,8
newsland,  NewsLand Войти Войти,8
breastenlargementmagazine, leyu  leyu 乐于体育下载   leyu 乐于体育下载【集团】有限公司 leyu,8
freehomepage, Web Hosting  Web Site Hosting  Free Web Site  Web Hosting Reviews  Free Web  web hosting services  Site Hosting Services  Free Home Page  Web Hosting Web   Free Web Hosting,5
ebay, Fly Streetwear Gardenia  Fly Streetwear Low  Low Pro Fly  Pro Fly Streetwear  Dunk Low  Dunk Low Fly  Fly Streetwear  Low Fly Streetwear  offPrevious price   Dunk Low Pro,8
liga,  FMCG Новини компаній,8
ads, Google  Google Ads account  Google Ads Mobile  Google Account  Google Play  Ads  Google services  Google Ads Editor  Google Ads API   Google Ads,8
pornhub, Videos  Porn Videos  Top Rated Albums  Top Rated GIFs  View Playlist  views  Exclusive Content  Popular Verified Models  Viewed Albums   Free Porn Videos,8
torrentsfilm, Start payment plan  Start payment  payment plan  payment  Buy  Start  February  domains  WhoIs Privacy Protection   domain,0
dictionary, SolverScrabble Word FinderWord  Word FinderWord PuzzleHurdleOutspellWord  MeaningsGamesGamesDaily Crossword PuzzleCrossword  Crossword PuzzleCrossword SolverScrabble  SexualityMixed-up MeaningsGamesGamesDaily Crossword  emailI inAboutCareersContact UsCookies  SolversLearnLearnWord ListsNew WordsTrending  ListsNew WordsTrending WordsAll  ArtsWritingWritingGrammar CoachWriting PromptsGrammar   PuzzleCrossword SolverScrabble Word,8
imrussia, Modern Russia  Resource  CMYK  rdf  process  Russia  Type  Institute of Modern  Vladimir Putin   xmpG,8
wedo, site owner  Block Technical Data  site  Wordfence blocking tools  million WordPress sites  Wordfence blocking  Technical Data  WordPress sites  access   Wordfence,8
budweiser, LEGAL DRINKING AGE  People Democratic Republic  Budweiser  link redirects  BUY  ONDE  COMPRAR  Republic  ENTER THIS SITE   ONDE COMPRAR,8
dopplr, Dopplr Legal  Understanding Defamation Lawsuits  Legal  Whistleblower Protections  Halloween Food Safety  Defamation Lawsuits  Food Safety Tips  Lawsuits  Lawsuits legal   Min Read,8
maxim-sokolov, Italiano Русский Українська  User agreement maxim  comment  accept LiveJournal User  User agreement  Log   LiveJournal User agreement,2
dikoe-pole, form  completely  filled  Address  offer  optional  Buy this domain  USD  domain   filled out completely,4
proxy, site  VPN List  Web Proxy List  Proxy  List VPN List  List  Proxy List VPN  agreement  Proxy.org   Proxy List,8
translate, SolverScrabble Word FinderWord  Word FinderWord PuzzleHurdleOutspellWord  MeaningsGamesGamesDaily Crossword PuzzleCrossword  Crossword PuzzleCrossword SolverScrabble  SexualityMixed-up MeaningsGamesGamesDaily Crossword  emailI inAboutCareersContact UsCookies  SolversLearnLearnWord ListsNew WordsTrending  ListsNew WordsTrending WordsAll  ArtsWritingWritingGrammar CoachWriting PromptsGrammar   PuzzleCrossword SolverScrabble Word,8
antijob, Details Page  mahost.org  domain.Domain Details  Page  Buy this domain.Domain  Details  Buy  JavaScript enabled  enabled   domain.Domain Details Page,4
ccel, God  Christian Life  Early Church Fathers  Read online  Christ  Classics Ethereal Library  Christian Classics  Christian  Church Fathers   Christian Classics Ethereal,8
anonymouse, Contact Info  Kontakt Info  Privacy Policy  FAQ  Info  service  privacy  Copyright   Anonymouse,0
gatesfoundation, Gates Foundation  Melinda Gates  Gates Foundation Privacy  Gates Foundation works  Gates Philanthropy Partners  Foundation  Gates  Gates Foundation commitment  Cookies Notice   Melinda Gates Foundation,1
adore, Red Cross Red  Red Cross Society  International Red Cross  National Red Cross  Cross Red Crescent  Red Crescent Movement  Red Cross  Red Crescent Society  Red Crescent   Red Crescent Societies,8
collegehumor, MMMMMMMMMMMMMMMMMMMMF  Dropout  MMMMMMMMMMMMMMMMMM  Dropout Connected Ventures  MMMMMMMMMMMMMMMMMMMM MMMMMMMMMMMMMMMMMMMM  comedy  watch  Dropout Connected  Android   MMMMMMMMMMMMMMMMMMMMMMMMMMMMMMMMMMMMMMMMMMMMMMMMMMMMMMMMMMMMMMMMMMMMMMMMMMMMMMMM,8
ifeminists, commentary  Ayn Rand  Bitcoin Cash address  Atlas Shrugged Part  round-up on Ayn  Ayn  Shrugged Part  Wendy McElroy  McElroyAtlas Shrugged Part   commentary round-up,8
666games, Free Online Flash  Gruesome Brutal Zombies  Bloody Horror Murder  Painful Deathly Kill  Kill Extremely Terror  Deathly Kill Extremely  Horror Murder Sadistic  Terror Gruesome Brutal  Gory Painful Deathly   Violent Bloody Horror,8
timesofindia, Times Internet  Bhai Kisi  time Times Internet  Miss India World  Miss India  Kisi Ki Jaan  Times Fashion Week  Jonathan OwensSimone Biles  Times   Femina Miss India,8
kurush1, friends RSS Блог  LiveJournal User agreement  Entries Friends Archive  Friends Archive Profile   RSS Блог Максима,3
seclists, Snort Subscriber Rules  Infrastructure Security Agency  RISKS List Owner  Nmap Security Scanner  Security Mailing List  Open Source Security  Apple Product Security  Security Lists  Releases Security Updates   Subscriber Rules Update,8
anglicancommunion, Enable JavaScript  cookies to continue  Enable  continue  JavaScript  cookies  JavaScript and cookies   moment,6
osp-ua, Resources  osp  Expired  Renewal Instructions  Instructions  Privacy Policy  Domain  Policy  Renewal   osp ua Resources,0
justicewomen, Justice Center  Womens Justice  Center  Justice  Womens   Womens Justice Center,8
aseansec, full functionality  enable  JavaScript  full  functionality  site  web browser  browser  instructions   enable JavaScript,6
carnivalcasino, Carnival Casino  Online Carnival  Casino  Carnival  Online   Online Carnival Casino,0
csmonitor, Christian Science Perspective  Science Monitor  Monitor Daily  Christian Science  Monitor View  Monitor Weekly digital  Monitor  Science Monitor Breakfast  Monitor Weekly   Christian Science Monitor,8
redenginejeans, redenginejeans.com is coming  totally awesome  awesome idea  redenginejeans.com  coming soon redenginejeans.com  coming  totally  awesome  idea   totally awesome idea,8
ifacetimeapp, Android App Download  FaceTime Download App  FaceTime APK App  FaceTime App  Android APK  Apple Facetime app  download Facetime APK  Download App  App   Download App Windows,8
obozrevatel, OBOZREVATEL може  OBOZREVATEL  MICLIC отримала Україна   OBOZREVATEL дозволяється лише,8
cannabis, Marijuana Treatment Centers  Florida  Ghost Management Group  star average rating  storefronts Dispensaries View  miFlorida Medical Marijuana  Medical Marijuana DoctorsMedical  Dispensaries View allLady  Doctors View allGainesville   Doctors Doctors View,8
blogspot, blog  beautiful blog  Create  blog easily  Create your blog  Blogger  Create a unique  beautiful  Google   beautiful blog easily,8
alstrangers, Entries Friends Archive  Friends Archive Profile  RSS Все временно  RSS Все   friends RSS Все,3
casinotropez, casino  Services Malta Limited  Entertainment Services Malta  Type  Universe Entertainment Services  casino games  Tropez  Online Casino  obj   Casino Tropez,0
globet, TRUST  Biggest Jackpots  Huge Bonuses  Odds  Jackpots  Bonuses  COMING  sportsbook will return  return   Globet.com,8
store, Action RPG  Steam Subscriber  Steam Deck  Adventure RPG  Off-topic Review Activity  Strategy RPG  Valve Corporation  Steam  Steam Curators   Steam Subscriber Agreement,8
genderandaids, Gender Equality  Education Plus’ Initiative  Generation Equality Forum  Women  Equality  Gender Equality Dimensions  Education Plus’  HIV Response  Generation Equality   HIV,8
abclider, piligriimmilii Гуру Репутация  Girl Huge Tits  Huge Tits Girls  refovod Гуру Репутация  NeoTyz Гуру Репутация  porn forum  Adult Videos Forum  adult porn   adult porn forum,8
flash, web server  Connection timed  Cloudflare Ray  origin web server  Cloudflare  Error  Connection  web  server   web server timed,5
holmogor, User agreement Разговоры  User agreement   LiveJournal User agreement,2
ilhr, full functionality  enable  JavaScript  full  functionality  site  web browser  browser  instructions   enable JavaScript,6
bnaibrith, B’nai B’rith Magazine  B’nai B’rith Impact  B’rith Impact B’nai  Impact B’nai B’rith  B’nai B’rith Talks  B’rith World Center  B’nai B’rith International  B’nai B’rith  B’nai B’rith Disaster   B’nai B’rith World,8
christianitytoday, Christianity Today  Asian American church  American church  Church  American church today  Privacy Policy  Christianity Today Weekly  CreedAll Blogs Topics  View Current Issue   Korean American church,8
crs, Catholic Relief  Relief Services  CRS Foundation Board  CRS Rice Bowl  CRS  Catholic Prayers Book  CRS Resource Center  CRS History  FREE Catholic Prayers   Catholic Relief Services,1
blueskyswimwear, Blue Sky Swimwear  Original Price  Power Enhancer Top  View  Tennis and Pickleball  Masks and Accessories  Face Masks  White Label  Private Label   Quick View,8
lb, Live Досьє Спецтеми   ENG Новини Політика,8
gmhc, People Living  AIDS Walk  Living with HIV  People  GMHC Hotline  Black People  GMHC  Health Benefits  AIDS   HIV,1
astalavista, server  requested URL  box.sk Port  API Solr  API Solr Default  URL  Debian  Port  Solr Default Core   Found,8
a-sadov, LiveJournal  User agreement  Italiano Русский Українська  account  English  Journal   Log,2
instinctmagazine, Favorite Instagrams  Miami Beach pride  Favorite Instagram Posts  EYE CANDY  Drag Race Hall  Drag Race  Instagram  Instinct  South Beach   Instinct Magazine,8
glavnoe,  href,8
lugansk, Der Kundensupport von  Sie  Der Kundensupport  Kundensupport von  Live-Chat kontaktiert werden  wenn sie  von BetStorm kann  und  sie die Arbeit   Kundensupport von BetStorm,8
ihr, United States  war  American Historical Review  President Franklin Roosevelt  HISTORICAL REVIEW  British Security Coordination  American  World  Mark Weber   World War,8
freshpair, Underwear Style Guide  Style Guide  Shop Styles  Shop Brands  Shapewear Style Guide  Brands  Panty Style Guide  T-shirt Style Guide  Top Brands   Bra Style Guide,8
turbobit, file  download  files  premium  account  File download  Upload  Turbo access  upload files   Turbo,8
catholic, Catholic Online  Catholic Online Prayers  Catholic Online Saints  Search Catholic Online  Online Prayer Candles  PRAYERS  Virtual Prayer Candle  Jesus Christ Prayers  Saints Feast Days   Catholic Online School,0
sfsi, San Francisco Sex  Sex Educator Training  Francisco Sex  Sex Information  San Francisco  Sex Educator  Sex  Information  Francisco   Francisco Sex Information,7
cidh, IACHR  Home   IACHR Home,8
rus, Enable JavaScript  cookies to continue  Enable  continue  JavaScript  cookies  JavaScript and cookies   moment,6
imo, official website  imo  free video  calls and messages  video calls  free  messages  official  website   free video calls,5
http-tunnel, Windows USB Recovery  USB Recovery Softwares  Tor Browser  Internet Censorship  HTTP Tunnel  Bypass Internet  Virtual Private Network  data recovery software  Data Recovery   Bypass Internet Censorship,8
finance, full reportAnalyst Report  Screener Futures Screener  Yahoo Finance Live  Finance Live Yahoo  Live Yahoo Finance  Screener ETF Screener  Screener Index Screener  Screeners Equity Screener  Year Yahoo Finance   Yahoo Finance,8
ecequality, Eastern Caribbean Alliance  Eastern Caribbean  MembersOur Networks  Networks and SupportOur  equality championJoin ECADE  MediaResourcesAnnual ReportsManualsResearch PublicationsNGO  ECADEOur TeamECADE MembersOur  ReportsManualsResearch PublicationsNGO DatabaseDonateContact  Networks   TeamECADE MembersOur Networks,8
ginvodka, Buying Guide  Gin Price  Vodka  Wine Gift Baskets  Gin  Gift Baskets  Sapphire Gin Price  Perignon Gift Baskets  Clicquot Gift Baskets   Vodka Brands,8
dw, enable JavaScript  JavaScript to run  app  enable  JavaScript  run   run this app,6
eve-kill,  Loading,8
biz, Biz.ly free hosting  free hosting site  Biz.ly FREE web  Web Hosting Resources  free website hosting  web hosting  Biz.ly web hosting  FREE web  free web site   FREE web hosting,5
circumcision, Circumcision Ronald Goldman  Ronald Goldman  Circumcision  Circumcision Resource  stop Medicaid circumcisions  Male Circumcision Harms  Circumcision Ronald  Medicaid circumcisions  Resource Center   Circumcision Resource Center,8
episcopalrelief, Life Garden Project  Episcopal Asset Map  Early Childhood Development  Childhood Development Work  Ukraine Crisis Response  Abundant Life Garden  Development  Childhood Development  Assets Builds Resilience   Episcopal Relief,8
cseindia, Environment Training Institute  CSE Lab Study  training programme  Programme Support FSSM  Anil Agarwal Environment  CSE training programme  Urban Water Management  Technical Support Unit  India Environment Portal   Agarwal Environment Training,8
4chan, Enable JavaScript  cookies to continue  Enable  continue  JavaScript  cookies  JavaScript and cookies   moment,6
drugspowerstore, drugspowerstore.com drugspowerstore.com  drugspowerstore.com  Privacy Policy  Reserved  Policy  Privacy   Copyright,0
astrojyoti, Vastu Shanti Pooja  Patanjali Yoga Sutras  nakshatra shanti poojas  Gita  Bhagavad Gita  Holy Pooja Shankha  Shanti Pooja  Bhagavad Gita recital  Full Bhagavad Gita   Gita Lord Krishna,8
bravotube, Big Black Cock  MILF Richelle Ryan  Richelle Ryan  Tori Black  Amy Brooke  big tits enjoys  years  big tits  site   Added,8
ncac, NCAC Book Censorship  National Coalition  School Officialsfor Artistsfor  Free Expression  JOIN NCAC  Art Administratorsfor Activistsfor  Youth Free Expression  Free Expression Program  Resource CenterYouth Censorship   Free Expression Film,5
semyanich, Bad gateway  Bad  gateway error  Cloudflare Ray  Error  gateway  Working semyanich.com  Working  Error code   bad gateway error,8
sakhr, SolutionSchool Management SystemSMS  Management SystemSMS OverviewSMS  Sakhr Software  SolutionSchool Management  Management SystemSMS  School Management System  Management  Arabic language technology  SakhrAbout SakhrOverviewContact UsSolutionsMachine   Portale-Portal SolutionSchool Management,8
azartplay, CONTRACTOR  domain  Buyer Protection Program  secure domain ownership  domain ownership  Dan.com  services  party service providers  VAT exampleThe VAT   domain ownership transfer,4
humanrightsfirst, Asylum Seekers  Systemic Injustice  Work  Join the Work  Asylum  Afghan Legal Assistance  Google Privacy Policy  Injustice  Seeking Asylum   Human,0
shamash, Shamash Hadash  Kehillot  Hadash  Shamash  Clear  content  glass  gazed  transparency   Clear Kehillot,8
mynews-in, Found error  requested URL  URL  Additionally  server  request  handle the request  requested  error   Found,8
fuckingfreemovies, ago  week ago  Asian  days  day ago  Asian teen  Thai  Big  teen   days ago,8
ukr, denied  Access  Error  site  code  Error code  site owner  owner  UTC   Access denied,8
from-ua, restrict access  Access  denied  Cloudflare  UTC  website  Ray  restrict  enable cookies   Access denied,8
2shared, service  file  Copyright Infringement  Terms  file upload  Copyright  Policy  files  Customer data   Privacy Policy,0
freespeech, ICANN  domain  ICANN Working Group  ICANN Expected Standards  Losing FOA  ICANNTags ICANN  Transfer Security  transfer  Working Group   ICANN Transfer Policy,4
debate, Christian response  Qur’an’s Documentary Evidence  Attraction of Islam  Qur’an’s Manuscript Evidence  States of Christ  Christian  Qur’an’s Archeological Evidence  Christian ’s Response  Christian Muslim   Christian Muslim Debate,8
pocciy, POC  POC Skull Comp  Pocciy.com  POC Ski Helmets  Privacy Policy  Helmet  Policy  POC Ski  Notice   POC Skull,0
earth-liberation-front, situs online poker  Life Oregon Lotto  situs poker online  Limit Omaha Poker  Situs Judi  Omaha Poker Players  situs bisa Anda  Oregon Lotto Game  Pragmatic situs judi   Earth Liberation Front,0
digg, Cordillera Peoples Alliance  Future Council Peace  Global Futures Forum  Alliance Impact Report  Action Alert  World Future  Campaign Report  Action  Blog Post   World Future Council,8
r, Search SettingsAOL Web  Search results  AOL Search  search results open.In  AdsPowered by Bing  explicit adult content  Search  filter resultsOpen search  explicit content   AOL Search SettingsAOL,8
freeservers, United Online Web  Web Services  Web Hosting Services  Online Web  United Online  UOL Web Services  UNITED ONLINE COMPANY  Free Web Hosting  Web Hosting Packages   Online Web Services,5
en, Apps Ресурсы Поддержка  Google Apps Ресурсы   WordPress Плагины WordPress,8
oblicomorale,  Pinterest Електронна пошта,8
news,  FMCG Новини компаній,8
lgbt, LGBT Sexual Health  Foundation Training Academy  LGBT Foundation Housing  LGBT Patient Experience  LGBT Foundation  Equality Wins LGBT  Manchester LGBT Extra  LGBT Domestic Abuse  LGBT IDVA Greater   LGBT Foundation Training,1
abcnews, ABC NewsVideoLiveShowsClimateInterest Successfully  Privacy RightsChildren Online  RightsChildren Online Privacy  Online Privacy PolicyInterest-Based  State Privacy  Online Privacy  Online Privacy Policy  ABC  Children Online Privacy   State Privacy RightsChildren,0
bitcomet, GUI Bugfix  Core Improve  GUI  Core Bugfix  improve  Bugfix  HTTP task  option window  torrent list   GUI Improve,8
itc, Found  nginx   Found nginx,8
hotmail, account requires JavaScript  Microsoft account  account requires  requires JavaScript  Microsoft  JavaScript  account  browser  requires   Microsoft account requires,8
grandonline, Play for Real  real  Money  JackpotPlay for Real  Beats Jackpot Play  Jackpot Play  Wild Jackpot Play  Space Jackpot Play  Wizard Jackpot Play   Real Money,8
blizzard, IIIAction RPGDiablo IIIAction  RPGDiablo ImmortalAction RPGDiablo  ResurrectedAction RPGDiablo IIIAction  ImmortalAction RPGDiablo ImmortalAction  ImmortalAction RPGDiablo IIIAction  IIIAction RPGDiablo ImmortalAction  RPGDiablo IIIAction RPGStarCraft  RPGDiablo ImmortalAction RPGHearthstoneStrategy  GameDiablo ImmortalAction RPGDiablo   RPGDiablo IIIAction RPGDiablo,8
freewebspace, Web Space  Free Web  Switch Web Hosting  Dedicated Free Web  Free Web Spaceby  Web  Web Space servers  Web Space ensure  Account Signup   Free Web Space,5
earthaction, World Future Council  Action Alert  Global Futures Forum  Blog Post  climate change  Alliance Impact Report  Future Council Peace  Action  World Future Day   Cordillera Peoples Alliance,8
ihrc, Palestine Campaign  Genocide Memorial Day  Zakzaky Campaign  IHRC  Report an Incident  Prison Packs Campaign  Packs Campaign  Decolonial International Network  Campaigns   Campaign,8
feministing, Hillsboro High School  High School  Hills High School  span style  School High School  Barton High School  Feministing  Support Feministing  Senior High School   Denfeld High School,8
bakerlawfirm, Found  HTTP  Status  Louis  pageFeaturesPricingLog InHomeFeaturesPricingAsa BakerDad  photosAsa Baker  date browsers  newer browser  Asa Baker   HTTP Status,8
atimes, Buy Steroids Online  Testosterone Cypionate  HGH injectionsBuy Primobolan  steroids  HGH  buy Testosterone Cypionate  Online Steroids  Buy Restylane online  buy HGH   Clenbuterol onlineCheapest HGH,0
rutracker, DVD Video  DVD видео Музыкальное   Macintosh Игры для,8
gulag, endobj  obj  Type   endstream endobj,8
childrenscinema, full functionality  enable  JavaScript  full  functionality  site  web browser  browser  instructions   enable JavaScript,6
lgbtmap, LGBTQ Youth Laws  Transgender Youth Sports  LGBTQ Movement Capacity  LGBTQ Youth  LGBTQ adult population  Transgender Youth  LGBTQ Equality  LGBTQ Equality Maps  Crime Laws   LGBTQ People Raising,8
wwf, Panda Symbol WWF  WWF Registered Trademark  WWF Independent review  World Wildlife Fund  WWF  WWF Independent  WWF International  Symbol WWF  WWF Registered   World Wide Fund,8
