Domain,Keyphrases,Cluster
guerrillagirls, College Art Gallery  STREET PROJECTS  art  Museum für Kunst  GUERRILLA GIRLSGuerrilla Girls  und Gewerbe Hamburg  University Art Gallery  Guerrilla  Kunst und Gewerbe   Guerrilla Girls,8
gaytoday, Enable  Date and Time  Address Date  Enable JavaScript  service  Cookies  security service  online attacks  protection against online   Enable Cookies,6
hackforums, Site Challenge  Hack Forums  reload the page  Cookies and reload  reload  Forums  page  enable Cookies  Cookies   Challenge,8
vdagestan, WordPress Hosting  Hosting  WPX  Website Disabled  WordPress  Disabled  Website   WPX Hosting,5
gayzona, full functionality  enable  JavaScript  full  functionality  site  web browser  browser  instructions   enable JavaScript,6
vsyapravda,  Result Политика Экономика,8
hrpublishers,  Human Rights Publishers,8
eea, Information System  official European Union  European Information Systems  European Union website  European Environment Information  European Union  European Environment Agency  information systemsBiodiversity Information  systemsBiodiversity Information System   Water Information System,7
transsexual, life  gender  time  hormones  sex  transition  body  surgery  Physical Sex   transsexual,8
hivandhepatitis, European AIDS Conference  EASL International Liver  International AIDS Conference  HIV Prevention Conference  AASLD Liver Meeting  AIDS Society Conference  Reduction International Conference  International AIDS Society  AIDS Conference   International Liver Congress,8
freeexpression, Free Expression  JOIN NCAC  Free Expression Network  ProgramYouth Free Expression  ArtYouth Free Expression  National Coalition  Expression  Free Expression ProgramKids’  School Officialsfor Artistsfor   Free Expression Film,5
afew, AFEW Partnership  EECA INTERACT  AFEW International  AFEW Academy  AFEW  Capacitating Public Health  Public Health  Solidarity Programme  Health Initiatives   Public Health Initiatives,1
lifestream, Harry Belafonte prompts  Harry Belafonte  President Joe Biden  girlfriend Erin Darke  President Biden  Erin Darke  Tucker Carlson  legend Bob Newhart  President Biden economic   President Donald Trump,8
ifrc, Red Crescent Societies  Cross Red Crescent  Red Cross  International Red Cross  National Red Cross  Red Crescent Movement  Red Crescent  Red Cross Society  Red Cross Societies   Red Cross Red,8
bacardi, BACARDÍ Reserva Ocho  BACARDÍ Spiced Rum  SHARECELEBRATE HALLOWEEN BACARDÍ  HALLOWEEN BACARDÍ STYLERUM  BACARDÍ  RUMS BACARDÍ RUM  BACARDÍ Rum  BACARDÍ Coconut rum  BACARDÍ Carta   BACARDÍ Carta Blanca,8
hostgator, customer service team  HostGator  website  assistive technology  unable to read  read any part  customer service  service team  team will assist   HostGator website,4
euro, European health report  Health  European Health  European Health Information  European Public Health  Europe  European Immunization Agenda  European Programme  Public Health Week   European Immunization Week,1
arabnews, Saudi Arabia  cases Saudi Arabia  Saudi Cup  April  Sonia Ben Ammar  Saudi  MediaMEDIA POWER LISTS  Saudi Arabia continues  South Sudan   Saudi Arabia reports,8
beeg,  Beeg,8
nordrus-norna, User agreement nordrus  accept LiveJournal User  User agreement  User  LiveJournal User   LiveJournal User agreement,2
altavista, Gainesville Good  Good day  Web  Mock Draft  Yahoo Search  Gainesville  Good  Search queryTrending  Yahoo   Gainesville Good day,8
buddhanet, Tree Forest Monastery  Bodhi Tree Monastery  Bodhi Tree  Contact Bodhi Tree  World Buddhist Directory  Buddha Dharma Education  Tree Forest  Dharma Education Association  Vipassana Retreat Centre   Bodhi Tree Forest,8
login, WebMoney Keeper  Keeper  WebMoney Keeper WinPro  Keeper WinPro  Keeper WebPro  directory not found  WebMoney Keeper Standard  File  WmLogin   File or directory,8
uncyclopedia, community  Community Central  Central  Wiki  FANDOM Lifestyle Community  Sitemap  Explore  Wikis  valid community   Fandom,8
coquette, Pink Collection  Elite Packaged Line  Packaged Line  Coquette International  Franklin Blvd  Texas USA  Collection  Coquette  Pleasure Collection   Crystal Pink Collection,8
honduras, Políticas de privacidad  los  nuestro sitio  Speciality Coffee Expo  Global Speciality Coffee  Honduras  información  Términos y Condiciones  para   abril,8
moyashkola, Family and Friends   editionпоказать обложкуУчебники Биология,3
adultfriendfinder, Largest Adult Community  contact Customer Service  Find Adult Singles  Adult Friend  sex dating  Password reset link  Adult Dating  Adult Dating Site  Free Adult Dating   Adult Friend Finder,5
eln-voces, Quels sont les  Des  Remède naturel  est  une  naturel  sont les  pour  ses blocages avec   les,8
date, Dating  Online Dating  Privacy Policy  Man  members  app  start dating  seeking  woman   Find,0
amygoodloe, check the URL  page  URL  Found  exist.Please check  exist.Please  check  back  Page Not Found   Error,8
hackhull, People  hackHull  Unix  nix  updated  Electronics  Networks  ITX  Projects   Hull,8
benedelman, Harvard Business School  Google search  competition consumer protection  consumer protection  platforms advertising advertising  HBS Executive Education  American Airlines Checked  economics law management  Airlines Checked Bag   Google,8
fotolog, CBD Water  Guide Дмитра Врачарић  Doors Дмитра Врачарић  CBD  Net Worth  URL Shorteners   American Flag Proudly,1
babylon-x, Privacy Policy  Reserved  Policy  Privacy   Copyright,0
chadayev, LiveJournal User agreement  friends RSS chadayev  Entries Friends Archive  RSS Reader  Italiano Русский Українська  accept LiveJournal User   Friends Archive Profile,3
comohacerseunaborto, aborto con medicamentos  aborto  CON PASTILLAS  SOBRE ABORTO SEGURO  Sitios web  aborto con  Puerto Rico  República Dominicana  Costa Rica   aborto seguro,8
betfair, In-Play  Arcade games  Betfair Bonus Roulette  games play  Betfair Casino Limited  Counterparty Services Limited  PPB Counterparty Services  Betfair  place bets   Arcade games play,8
icrw, ICRW Africa  ICRW Asia  Research Protection Program  Paula Kantor Award  ICRW works  ICRW Advisors  Women  Research  Human Research Protection   ICRW,8
hindunet, Resource Center  Hindu Universe  Hindu Resource  Universe  Center  Hindu  Resource   Hindu Resource Center,8
ifex, free expression  United States  Central African Republic  IFEX  IFEX Statements  media freedom report  Press Freedom Index  United Arab Emirates  IFEX Twitter   United Kingdom,8
abortionno, CBR Abortion Photos  CBR Appeal Letter  CBR Photos  Genocide Awareness Project  PROLIFE RESOURCES Abortion  Pro-Life Intern Program  abortion photo signs  PROJECTS Genocide Awareness  Abortion Photos   RESOURCES Abortion Photos,8
chantelle, CHANTELLE  demi bra  Bras  Semi-Annual Sale  Unlined Underwire Bra  T-Shirt Bra  Sale  Chantelle bra fit  Smooth Demi Bra   BRA,8
euractiv, EURACTIV MEDIA NETWORK  European Commission  European Public Projects  EURACTIV European  EURACTIV  EurActiv Press Release  Featured Content  EURACTIV MEDIA  European   EURACTIV European Public,8
bestrussiandating, full functionality  enable  JavaScript  full  functionality  site  web browser  browser  instructions   enable JavaScript,6
datpiff, DatPiff  Authority  Generation  Youtube and Instagram  reload the page  Archive.org  Library accessible  Generation of DatPiff  mixtape releases   Authority In Mixtapes,8
okkupatsiya,  Loading,8
beer, Beer.com Domain PortfolioBeer.comDo  entire global beer  Domain PortfolioBeer.comDo  beer market  Beer.com Domain  PortfolioBeer.comDo you possess  possess the courage  courage and vision  entire global   global beer market,8
dailymail, Trust Global Gala  Corden Late Late  James Corden Late  Prince Trust Global  Late Late  James Corden  Late Show  Prince Trust Gala  James Corden final   Late Late Show,8
amvrosievka, Enable JavaScript  cookies to continue  Enable  continue  JavaScript  cookies  JavaScript and cookies   moment,6
coordmedcentr, MEGA DARKNET  mega mega сайт  DARKNET MARKET Каталог  MEGA   MEGA DARKNET MARKET,8
economist, Economist Newspaper Limited  Economist explainsWorldThe world  Economist  American economist  Economist Newspaper  Economist readsSummer readsChristmas  Economist readsSummer  World  World Trade Organisation   Economist GroupThe Economist,8
genderhealth, CHANGE Global Advocacy  Twitter IconA Twitter  Facebook IconA Facebook  GLOBAL FEMINIST ALLIANCE  Western Hemisphere Region  Planned Parenthood Federation  Parenthood Federation Western  Federation Western Hemisphere  International Planned Parenthood   CHANGE Applauds President,8
vanguardnewsnetwork, Trump Derangement Syndrome  William Pierce  Posted by Socrates  Permanent Link  VNN Black Statistics  White Western culture  White People  White  Middle East Wars   William Pierce Wednesday,8
dw-world, enable JavaScript  JavaScript to run  app  enable  JavaScript  run   run this app,6
bahai, Bahá’ís BelieveWhat Bahá’ís  Bahá’í FaithThe Official  Bahá’í CommunityWhat Bahá’ís  Bahá’ís DoNational Bahá’í  Bahá’í Community عربي中文  Bahá’í Reference Library  Bahá’í CommunitiesBahá’í Reference  Bahá’í FundsSharing Bahá’í  Bahá’í Community   Worldwide Bahá’í Community,8
a-osipoff, Link  Thread  Reply   UTC,8
derechos, Long War  War Journal  Nations Security Council  ENG  South China Sea  Fdd Long War  Bill Roggio  York Times  las Naciones Unidas   Long War Journal,8
barnesandnoble, Add to Wishlist  ADD  York Times Book  Wishlist  QUICK  Times Book Review  Exclusive Edition  York Times bestselling  York Times   QUICK ADD,8
bglad, Live Guys Cams  Star Video Archive  FREE Unlimited Access  show type  Adult Star Video  hour Feature Shows  Private Video Preview  Party Chat  Guys Cams   Free Users Chat,5
fark, Fark  Friday Fark Gaming  Fark Party Forum  Fark Gaming Thread  share  Friday Fark  Fark Forum  Forum Link Voting  Fark Book   Fark Forum Link,8
2ddepot, Reply  April  Game  Reply khloe  back  Melanie Martinez  n’t  Dev log  Martinez   Ximito,8
absolut, Absolut Mango Mule  Absolut  Absolut Grapefruit Paloma  Absolut Berry Vodkarita  Absolut Pineapple Martini  Absolut Company  Absolut Elyx  Absolut Citron  Absolut Mango   Absolut Vodka,8
nypost, USD  York Post  Post Official Store  Post Sports  Apple Podcasts Spotify  Aaron Rodgers  Rodgers Jets jerseys  Sports Betting  outdoor patio furniture   Aaron Rodgers Jets,8
polemika,  RSS Полемика Новости,3
brookings, Brookings Institution  Brookings Privacy Policy  Brookings  Brookings Press  Brookings Institution Privacy  Brookings Privacy  Institution Press  Institution  Search Brookings   Brookings Institution Press,0
doctissimo, Les  des  famille  Article  vous  pour  Bébé  Grossesse  Beauté   Santé,8
bitcoin, EEE  iii  qqq  yyy  PNG  IHDR  IEND  nnn  UUU   IDAT,8
childrensdefense, Children Defense Fund  Defense Fund Youth  CDF Freedom Schools  Defense Fund  Fund Youth Voices  Defense Fund Action  Children ’s Defense  Youth Voices Storytelling  Defense Fund Community   Defense Fund Sites,8
canna, House Pool Party  Die Schönsten Tiroler  Deep House Pool  Robin Fuchs  Top Hits  Single Charts  Deep House Essentials  Deep House Music  Die Drei Fragezeichen   Pech und Schwäfel,8
feedtheminds, Minds  Feed  Economic Empowerment  Internet Service Provider  People  Minds data protection  education  Empowerment  education projects   Feed the Minds,8
broadvoice, Cookie Consent plugin  Cloud Contact Center  Business Phone System  GDPR Cookie  Cookie Consent  Contact Center  Customer Success Program  Contact Center solutions  cookies   GDPR Cookie Consent,8
foreignword, European Commission Translation  Terminological Information System  Dictionaries for French  translation  dictionaries  Translation Service  Terminological Information  French  Commission Translation   Commission Translation Service,7
jurist, Supreme Court  Supreme Court Monday  Judicial Reform Protests  Reform Protests Explained  Newcastle Law School  JURIST Legal  Law School  Law  France court Tuesday   Supreme Court rules,8
drugsense, Media Awareness Project  Drug Policy  Drug Policy Central  MAP  Drug  Awareness Project  Policy  drug policy organizations  Media Awareness   drug policy reform,8
cvs, project summary page  Open Source Software  Project  Business Software  project summary  project web  Source Software  Site Documentation  Software   project web site,5
enom, certified reseller  Enom Certified Reseller  Enom  Reseller Agreement  Domain  Reseller  Domains  SSL   Certified Reseller Agreement,8
exmormon, Mormon  Mormon Church Anonymous  Mormon Church City  Mormon Church general  Mormon Church admits  Church  Mormon Church Essay  Mormon Church Doctrine  Official Mormon Church   Mormon Church,8
cartercenter, Carter Center  Carter Center Health  Carter Center Mental  Mental Health Program  Carter Center Experts  Carter Center programs  Carter Center Weekend  Center Health Programs  President Jimmy Carter   Carter Center Event,1
icftu, Viasat Internet  Viasat  Viasat internet plan  Viasat Satellite  Viasat Internet Provider  Viasat Voice  ViaSat Internet Quote  Satellite Internet  Internet   Viasat Satellite Internet,8
chinadaily, China Daily E-paper  China Daily Information  China Daily  China  China Daily Website  Connecting China Connecting  Daily PDF  Daily E-paper  Daily Information   China Daily PDF,7
150m, Free Web Hosting  PHP Web Hosting  Free Web  Web Hosting  Web Space  FrontPage Web Hosting  web hosting service  Web  Web Space Inc.   Free Web Space,5
angryharry, Golden  Slience   Slience is Golden,8
ftchinese, Financial Times Ltd.  Financial  Times  Times Ltd.  ESG   Financial Times,8
dit-inc, Internet Technology  Dynamic Internet  Press Release  Chinese Communist Party  Internet Circumvention Technologies  Internet Technology Inc.  DIT released Report  Chinese People Renouncing   Dynamic Internet Technology,8
eharmony, Dating site  Dating Christian Dating  Free Dating Site  International Dating Site  Black Dating Site  Dating  Christian Dating  Gay Dating Site  Lesbian Dating Site   Christian Dating Site,5
gamingday, domain  party service providers  services  domain ownership transfer  Brokered Domain  Client  Dan.com  Terms  Rental Agreement   CONTRACTOR,4
anekdot-blogger,  Twitter Counter.com ДНР,8
adium, Adium Videos Adium  Adium Documentation  HTTP Server  Videos Adium Documentation  Page  Apache HTTP Server  Test Page  Adium Xtras documentation  AlmaLinux Test Page   Adium,8
krown-products, Copyright Krown Products  web site owner  Products  web site  site owner  site  Quality Digital Models  Concept Design Services  Project   Krown Products,5
dogpile, Enable JavaScript  cookies to continue  Enable  continue  JavaScript  cookies  JavaScript and cookies   moment,6
squarespace, Squarespace Logo  Squarespace Customer Service  Squarespace  Squarespace SEO expert  Squarespace users  SEO Tools  Logo Maker  real Squarespace users  Squarespace Member Areas   Squarespace Blog,8
hightimes, Dispensary Workers Strike  Current LED Rebates  Illinois Dispensary Workers  View Posts  High Times  Cannabis Cup  Cannabis  Cannabis Activists Protest  Product Review   High Times Magazine,8
kidshealth, Nemours Children Health  Nemours Foundation  LAME  Nemours Children  Nemours  Safety Tips  Kids  Kids Home  Teens Home   UUUUUUUUUUUUUUUUUUUUUUUUUUUUUUUU,1
thenationalcampaign, Birth Control Access  teen birth rate  Contraceptive Access Fund  Power Updates Edition  birth control  Contraceptive Access  birth control pills  Contractive Access Toolkit  Teen Pregnancy Rate   Power to Decide,8
onlybingo, Bingo Strategy  Online Bingo Strategy  Bingo  Online Bingo  net bingo  Mexico Bingo  Strategy Advice  March  Web Bingo   Bingo Strategy Advice,1
identi, return  var  this.  END LICENSE BLOCK  return function  return false  BEGIN LICENSE BLOCK  return this.  element   function,8
luxtorrents,  DropCatch.com,8
globalr2p, Responsibility to Protect  Occupied Palestinian Territory  Atrocity Prevention  Democratic People Republic  Central African Republic  Global Centre  African Republic  Expert Voices  Voices on Atrocity   Atrocity Prevention Episode,8
glaad, GLAAD Media Awards  GLAAD Accountability Project  give glaad media  GLAAD Media  GLAAD  glaad awards trump  trump accountability project  GLAAD Transgender Media  Media Safety Index   GLAAD Media Institute,8
radiofreetexas, Free Texas LIVE  Free Texas  Texas LIVE  Texas Music  Radio Free  Great Texas Music  Texas  live music experience  live music   Radio Free Texas,5
discord, Place  friends  Hang  invite-only place  Discord  often.DownloadOpen Discord  channels  group   Talk,8
cannabisnature, Start payment plan  Start payment  payment plan  payment  Buy  Start  February  domains  WhoIs Privacy Protection   domain,0
jakor, friends RSS Юрий  Entries Friends Archive  Friends Archive Profile  LiveJournal User agreement  accept LiveJournal User  User agreement jakor  RSS Reader   RSS Юрий Якорь,3
hvylya, Server Error nginx  Internal Server  Server Error  Error nginx  Internal  Server  Error  nginx   Internal Server Error,8
obkom,  Max Bezugly Расширенный,8
navy, Naval Operations  United States Navy  Chief of Naval  Master Chief Petty  Naval Personnel  CNO Professional Reading  Navy  MyNavy Career Center  Professional Reading Program   Chief Petty Officer,8
clubdicecasino, Online Club Dice  Dice Casino  Club Dice  Online Club  Casino  Club  Dice  Online   Club Dice Casino,0
norml, Reform Marijuana Laws  NORML Political Director  NORML  NORML State  NORML Foundation  State Policy Manager  State Policy Weekly  NORML Twitter  NORML Insta   NORML State Policy,0
ananzi, Pictures Toyota Hilux  Western Cape Western  Pictures Opel Corsa  days agoReport  agoReport AdView Photos  Cape Town  Pictures Ford Ranger  CMH Cape Town  Cars Cape Town   Coordinated Universal Time,8
nytimes, York Times Company  York Times CompanyNYTCoContact  York  reading the main  York Times Climate  Times  social media  Times CompanyNYTCoContact UsAccessibilityWork  York Times account   York Times,8
pussy-riot, sale pussy riot  Tags pussy riot  pussy riot sale   PUSSY RIOT,8
i, User-agent  publicapi  query  logging  batch  fetch  web  client  error   Disallow,8
blogeasy, Free Web Hosting  Free Blog  Blog Hosting  Free Web  Web Hosting  Privacy Policy  Free  Blog  free blog site   Free Blog Hosting,5
guardster, Guardster web sites  Amazon Services LLC  LLC Associates Program  Privacy Headquarters  Guardster  Web Sites  Privacy Policy  Guardster Recommends Nord  Guardster Recommends Atlas   Services LLC Associates,0
translation2, English  Tiếng Việt Українська  English Translation  Việt Dịch thuậtTiếng  English TranslationChinese Trad  Tiếng Việt  English TranslationChinese Simp  English TranslationHaitian Creole  English TranslationScots Gaelic   Tiếng Việt Dịch,8
frc, FRC Press Office  Research Council President  President Tony Perkins  Council President Tony  Research Council Tony  FRC Tony Perkins  Council Tony Perkins  Research Council  Family Research   Family Research Council,8
peoplefirst, Law Firms lawyer  Criminal Defense Lawyer  Firms lawyer legal  Injury Lawyer  Car Seat Laws  car accident lawyer  Injury personal injury  lawyer  Defense Lawyer   Personal Injury Lawyer,7
mc-masters, User agreement Максим  LiveJournal User agreement  accept LiveJournal User  LiveJournal  agreement Максим   agreement Максим Стрибный,2
expres, Republic   Islands,8
magicjack, Phone Service Provider  Home Phone Service  Money Back Guarantee  phone number  number  Service  Internet Home Phone  Service Provider  Back Guarantee   magicJack,4
crazyshit, PUBLIC ACTS  crazyshit  Porn Sites  Porn  Top Porn Sites  Crazy Shit crazyshit  Points  Porn Games  SHITTIER DAY   CrazyShit Live crazyshit,8
tdov, Simple Theme  Theme from Nimbus  TDOV  San Francisco  Theme  Themes  Powered  Powered by WordPressNothing  Nimbus   Nimbus Themes,8
occupystreams, Bandar Judi Online  Judi Online Casino  Judi Online Terpercaya  Dari Bandar Judi  Dari Judi Online  Online Casino Resmi  Agen Judi Online  Main Judi Online  Online Resmi Tembak   Judi Online Resmi,0
